{
  "access": "public_reference",
  "evidence_id": "EVID-ACME-002",
  "observed_at": "2026-02-24T09:39:00Z",
  "recorded_at": "2026-04-08T00:00:00Z",
  "related_businesses": [
    "BTR-ACME-001"
  ],
  "sha256": "ef72ef423753bcef8940978f9a7226f9f54b59cfe22c9b6af34140729a8b2bcd",
  "source_type": "procurement_notice",
  "source_url": "https://data.open-contracting.org/en/publication/64",
  "summary": "Published procurement record derived from published procurement data. Insil Services Ltd appears in FEDERAL CAPITAL TERRITORY ADMINISTRATION procurement record ocds-gyl66f-2-005234 for EMERGENCY PROCUREMENT SUPPLY OF NON-FOOD ITEMS TO SUPPORT FLOOD AFFECTED PERSONS IN THE FEDERAL CAPITAL TERRITORY.",
  "tags": [
    "procurement",
    "federal-nocopo"
  ]
}
