{
  "access": "public_reference",
  "evidence_id": "EVID-DELTA-002",
  "observed_at": "2026-02-19T10:41:00Z",
  "recorded_at": "2026-04-08T00:00:00Z",
  "related_businesses": [
    "BTR-DELTA-001"
  ],
  "sha256": "f155ae9042677f1b542931cc7d1ed842f224ea3865e9864414bed0a0bf2a9055",
  "source_type": "procurement_notice",
  "source_url": "https://data.open-contracting.org/en/publication/64",
  "summary": "Published procurement record derived from published procurement data. Extra_Tech Global Resources Ltd appears in FEDERAL CAPITAL TERRITORY ADMINISTRATION procurement record ocds-gyl66f-2-005011 for Emergency Repair Works/Maintenance of Failed Sewer Sections Identified in Northern Part of FCC (wuse II, Jabi & Katampe extension) & central part of F.",
  "tags": [
    "procurement",
    "federal-nocopo"
  ]
}
