{
  "access": "public_reference",
  "evidence_id": "EVID-EMBER-002",
  "observed_at": "2026-02-06T14:08:00Z",
  "recorded_at": "2026-04-08T00:00:00Z",
  "related_businesses": [
    "BTR-EMBER-001"
  ],
  "sha256": "45b5e88fb10e5e7ff943bf3f6d914416886c407ff0a5404b70e35c0e6d59b8a3",
  "source_type": "procurement_notice",
  "source_url": "https://data.open-contracting.org/en/publication/64",
  "summary": "Published procurement record derived from published procurement data. PREZGREEL INVESTMENT LIMITED appears in NATIONAL ORTHOPAEDIC HOSPITAL DALA KANO procurement record ocds-gyl66f-521027014-000199 for SUPPLY OF TWO (2) UTILITY VEHICLES; TOYOTA CAMRY MODEL 2015/2016 (TOKUMBO/FAIRLY USED).",
  "tags": [
    "procurement",
    "federal-nocopo"
  ]
}
