{
  "access": "public_reference",
  "evidence_id": "EVID-FALCON-002",
  "observed_at": "2026-02-06T14:26:00Z",
  "recorded_at": "2026-04-08T00:00:00Z",
  "related_businesses": [
    "BTR-FALCON-001"
  ],
  "sha256": "a8a7168b009b90c4268f93d2d32dfbf5ac233ce00e4b4eb83bbd7ddfd19b36d1",
  "source_type": "procurement_notice",
  "source_url": "https://data.open-contracting.org/en/publication/64",
  "summary": "Published procurement record derived from published procurement data. OVERZOMM GLOBAL INVESTMENT SERVICES LTD appears in NATIONAL ORTHOPAEDIC HOSPITAL DALA KANO procurement record ocds-gyl66f-521027014-000198 for SUPPLY OF MOBILE X-RAY AND C-ARM MACHINES.",
  "tags": [
    "procurement",
    "federal-nocopo"
  ]
}
