{
  "access": "public_reference",
  "evidence_id": "EVID-IVORY-001",
  "observed_at": "2026-02-19T10:11:00Z",
  "recorded_at": "2026-04-08T00:00:00Z",
  "related_businesses": [
    "BTR-IVORY-001"
  ],
  "sha256": "ae4d9eeb4c756368ea5f08da6522a1d05acaffd15f7ecd2e8d1f9424d77cbbcd",
  "source_type": "procurement_notice",
  "source_url": "https://data.open-contracting.org/en/publication/64",
  "summary": "Published procurement record derived from published procurement data. Musaby Nig. Ltd appears in FEDERAL CAPITAL TERRITORY ADMINISTRATION procurement record ocds-gyl66f-2-005029 for Emergency evacuation of waste in open dumps and collection pionts in the FCT Satellite towns (kubwa) lot1ps and collection in the FCT (KUBWA).",
  "tags": [
    "procurement",
    "federal-nocopo"
  ]
}
