{
  "access": "public_reference",
  "evidence_id": "EVID-JETTY-001",
  "observed_at": "2026-02-19T10:14:00Z",
  "recorded_at": "2026-04-08T00:00:00Z",
  "related_businesses": [
    "BTR-JETTY-001"
  ],
  "sha256": "99906220ea0efac96ffa3536cb328438d06ffe8546414843e92c7abd76b5d613",
  "source_type": "procurement_notice",
  "source_url": "https://data.open-contracting.org/en/publication/64",
  "summary": "Published procurement record derived from published procurement data. Boped Environmental Services Limited appears in FEDERAL CAPITAL TERRITORY ADMINISTRATION procurement record ocds-gyl66f-2-005442 for Emergency Evacuation of Waste in Open Dumps and Collection Points in the FCT Satellite Towns (Duse Ushafa Road and Dawaki Interchange Lot2).",
  "tags": [
    "procurement",
    "federal-nocopo"
  ]
}
