{
  "access": "public_reference",
  "evidence_id": "EVID-LAGOON-003",
  "observed_at": "2022-04-01T16:48:42Z",
  "recorded_at": "2026-04-08T00:00:00Z",
  "related_businesses": [
    "BTR-LAGOON-001"
  ],
  "sha256": "6d3305c253e45c3f915e90800253c9272de07caa3cfbede431214b52052fa17d",
  "source_type": "procurement_notice",
  "source_url": "https://data.open-contracting.org/en/publication/127",
  "summary": "Published procurement record derived from published procurement data. M O & C INTERNATIONAL LIMITED appears in MINISTRY OF POWER AND WATER RESOURCES procurement record ocds-j74acu-000720-MOP01-NG for Rehabilitation of 5No non-functional boreholes at State Secretariat complex including replacement of dislocated pipeline rising mains to the reservoirs.",
  "tags": [
    "procurement",
    "state-ocds"
  ]
}
