{
  "access": "public_reference",
  "evidence_id": "EVID-GRANITE-001",
  "observed_at": "2026-02-19T09:42:00Z",
  "recorded_at": "2026-04-08T00:00:00Z",
  "related_businesses": [
    "BTR-GRANITE-001"
  ],
  "sha256": "0a80152854b4aff578091a0abd54bcfa2ee23e3f3a98fbbea9a9df320e43f76c",
  "source_type": "procurement_notice",
  "source_url": "https://data.open-contracting.org/en/publication/64",
  "summary": "Published procurement record derived from published procurement data. Lemaco Engineering Ltd appears in FEDERAL CAPITAL TERRITORY ADMINISTRATION procurement record ocds-gyl66f-2-005019 for Emergency desilting of blocked drainage system on jabi, gudu, apo, katampe, airport and onex abuja (lot3).",
  "tags": [
    "procurement",
    "federal-nocopo"
  ]
}
