{
  "access": "public_reference",
  "evidence_id": "EVID-BLUESKY-001",
  "observed_at": "2026-02-19T10:23:00Z",
  "recorded_at": "2026-04-08T00:00:00Z",
  "related_businesses": [
    "BTR-BLUESKY-001"
  ],
  "sha256": "d72a5b92d0845ce95496bb33ae42053534a49c7254d7b56e211c9cb3a5733518",
  "source_type": "procurement_notice",
  "source_url": "https://data.open-contracting.org/en/publication/64",
  "summary": "Published procurement record derived from published procurement data. Laurmann & Company Ltd appears in FEDERAL CAPITAL TERRITORY ADMINISTRATION procurement record ocds-gyl66f-2-005438 for Evaluation of Accumulated Waste Dumps From Unconcenssioned and unplanned Settlement within and Around the Federal Capital City (FCC).",
  "tags": [
    "procurement",
    "federal-nocopo"
  ]
}
