{
  "access": "public_reference",
  "evidence_id": "EVID-GRANITE-002",
  "observed_at": "2026-02-19T09:56:00Z",
  "recorded_at": "2026-04-08T00:00:00Z",
  "related_businesses": [
    "BTR-GRANITE-001"
  ],
  "sha256": "7aad368a6a6e19f244d952ec0b6b673c430e5254e79ab7b7f8701f4148ff2250",
  "source_type": "procurement_notice",
  "source_url": "https://data.open-contracting.org/en/publication/64",
  "summary": "Published procurement record derived from published procurement data. Lemaco Engineering Ltd appears in FEDERAL CAPITAL TERRITORY ADMINISTRATION procurement record ocds-gyl66f-2-005025 for Emergency Evacuation of Silt and Drainages in Gwagwalada Area council.",
  "tags": [
    "procurement",
    "federal-nocopo"
  ]
}
